{
  "apiVersion": "greentic.ai/v1",
  "kind": "DesignExtension",
  "metadata": {
    "id": "greentic.adaptive-cards",
    "name": "Adaptive Cards",
    "version": "1.6.0",
    "summary": "Design and validate Microsoft Adaptive Cards v1.6",
    "description": "Schema-level validation, prompts, and tool exports for AdaptiveCards v1.6. Knowledge base ships empty; advanced examples curated separately.",
    "author": {
      "name": "Greentic",
      "email": "team@greentic.ai"
    },
    "license": "MIT",
    "repository": "https://github.com/greenticai/greentic-designer-extensions",
    "keywords": ["adaptive-cards", "ui", "microsoft", "design-extension"]
  },
  "engine": {
    "greenticDesigner": ">=0.6.0",
    "extRuntime": "^0.1.0"
  },
  "capabilities": {
    "offered": [
      { "id": "greentic:adaptive-cards/schema", "version": "1.6.0" },
      { "id": "greentic:adaptive-cards/validate", "version": "1.0.0" },
      { "id": "greentic:adaptive-cards/transform", "version": "1.0.0" }
    ],
    "required": []
  },
  "runtime": {
    "component": "extension.wasm",
    "memoryLimitMB": 64,
    "permissions": {
      "network": [],
      "secrets": [],
      "callExtensionKinds": []
    }
  },
  "contributions": {
    "schemas": ["schemas/adaptive-card-v1.6.json"],
    "prompts": ["prompts/rules.md", "prompts/examples.md"],
    "knowledge": ["knowledge/"],
    "tools": [
      { "name": "validate_card", "export": "greentic:extension-design/validation.validate-content" },
      { "name": "analyze_card", "export": "greentic:extension-design/tools.invoke-tool" },
      { "name": "check_accessibility", "export": "greentic:extension-design/tools.invoke-tool" },
      { "name": "optimize_card", "export": "greentic:extension-design/tools.invoke-tool" },
      { "name": "transform_card", "export": "greentic:extension-design/tools.invoke-tool" },
      { "name": "template_card", "export": "greentic:extension-design/tools.invoke-tool" },
      { "name": "data_to_card", "export": "greentic:extension-design/tools.invoke-tool" },
      { "name": "list_examples", "export": "greentic:extension-design/knowledge.list-entries" },
      { "name": "get_example", "export": "greentic:extension-design/knowledge.get-entry" },
      { "name": "suggest_layout", "export": "greentic:extension-design/knowledge.suggest-entries" }
    ]
  }
}
